รหัสโครงการ,ชื่อโครงการ,คณะ,ตำแหน่งหัวหน้าโครงการ,ชื่อหัวหน้าโครงการ,นามสกุลหัวหน้าโครงการ,ภาควิชา,งบประมาณ,วันเริ่มต้นโครงการ,วันสิ้นสุดโครงการ,สถานะ,ประเภทวิจัย,ประเภทบริการวิชาการ,ประเภททำนุบำรุงศิลปวัฒนธรรม
SCI-2565-001,การพัฒนาการตรวจวัดมลพิษทางอากาศด้วย IoT,วิทยาศาสตร์,รศ.ดร.,สมหญิง,ศรีธัญรัตน์,ภาควิชาเคมี,650000,2022-01-01,2022-12-31,กำลังดำเนินการ,1,1,0
SCI-2565-002,การวิเคราะห์ความหลากหลายทางชีวภาพในพื้นที่ป่าชายเลน,วิทยาศาสตร์,ผศ.ดร.,ปกรณ์,สุนทรไชย,ภาควิชาชีววิทยา,450000,2022-03-01,2023-02-28,กำลังดำเนินการ,1,0,0
SCI-2565-003,โครงการค่ายวิทยาศาสตร์สำหรับนักเรียนมัธยม,วิทยาศาสตร์,อ.ดร.,ณัฐพงษ์,แสงมณี,ภาควิชาฟิสิกส์,200000,2022-06-01,2022-08-31,เสร็จสมบูรณ์,0,1,1
ENG-2565-001,การพัฒนาระบบเซนเซอร์สำหรับเกษตรอัจฉริยะ,วิศวกรรมศาสตร์,รศ.ดร.,สมชาย,ดิถีธารา,ภาควิชาวิศวกรรมไฟฟ้า,800000,2022-01-01,2022-12-31,กำลังดำเนินการ,1,1,0
ENG-2565-002,การออกแบบและพัฒนาระบบจัดการน้ำเสียในชุมชน,วิศวกรรมศาสตร์,ผศ.ดร.,นภดล,ทองเพชร,ภาควิชาวิศวกรรมสิ่งแวดล้อม,350000,2022-04-01,2022-10-31,กำลังดำเนินการ,0,1,0
ENG-2565-003,การพัฒนาแอปพลิเคชันนำทางเพื่อผู้พิการทางสายตา,วิศวกรรมศาสตร์,อ.ดร.,วิรัลพัชร,จินดานิล,ภาควิชาวิศวกรรมคอมพิวเตอร์,620000,2022-02-01,2023-01-31,กำลังดำเนินการ,1,0,0
HUM-2565-001,ศิลปะกับการพัฒนาจิตใจ: กรณีศึกษาศิลปะบำบัดในผู้สูงอายุ,มนุษยศาสตร์,รศ.ดร.,พิมพ์ใจ,ปทุมาสูตร,ภาควิชาศิลปกรรม,400000,2022-01-01,2022-12-31,กำลังดำเนินการ,1,0,1
HUM-2565-002,การถอดรหัสวัฒนธรรมภาคใต้ผ่านภาษาถิ่น,มนุษยศาสตร์,ผศ.ดร.,สุนันทา,สุระวัตร,ภาควิชาภาษาไทย,350000,2022-05-01,2023-04-30,กำลังดำเนินการ,1,0,1